{
  "schema_version": 1,
  "case_id": "docx-novel-001",
  "status": "verified",
  "counting_policy": "unicode-codepoints-without-whitespace-v1",
  "source_hashes": {
    "novel-docx": "c2c13eaf5110ea7e68a41893b91c762151bab5e926e6cc316087b3dc99aa9a26"
  },
  "verification": {
    "primary": "ElementTree logical-paragraph walk selecting Choice",
    "independent": "minidom pruned-tree paragraph walk selecting Fallback",
    "paragraph_text_style_and_order_agree": true,
    "toc_and_body_headings_agree": true
  },
  "counts": {
    "numbered_chapters": 19,
    "epilogues": 1,
    "appendices": 1,
    "afterwords": 1,
    "body_sections": 22,
    "prepared_markdown_units": 23,
    "toc_entries": 22,
    "logical_paragraphs_including_empty": 2457
  },
  "totals": {
    "whole_document": {
      "nonempty_paragraphs": 1926,
      "characters_excluding_whitespace": 114063,
      "text_sha256_excluding_whitespace": "73eb745037f9d7ca9f0b3e575e79d64a5221390677cdcc27be0d42ab9df9c7a0",
      "paragraph_sequence_sha256": "cb973e62b04e5453b4d45112857f50416dd1796999026531098ea9cc9c339896"
    },
    "cover": {
      "nonempty_paragraphs": 3,
      "characters_excluding_whitespace": 21,
      "text_sha256_excluding_whitespace": "bafbc2d61ec169b0c0e9c65cd6cef4b63322650f78e884ce7d9e3319b57a3bae",
      "paragraph_sequence_sha256": "7b6cf9c9cad2e1a497199551c2ad8f287e56e258efd867ce12b06e996a79fddf"
    },
    "table_of_contents": {
      "nonempty_paragraphs": 23,
      "characters_excluding_whitespace": 153,
      "text_sha256_excluding_whitespace": "6a1db088851d2607fff726003a96da4515f2860c618181a392b4f6f798f8c71b",
      "paragraph_sequence_sha256": "a5783e6ed54b49274cd825c9da7c79e6946571e22aef9b1d8cdf599ff9952591"
    },
    "body_including_headings": {
      "nonempty_paragraphs": 1900,
      "characters_excluding_whitespace": 113889,
      "text_sha256_excluding_whitespace": "6d0c89093d90e18e340cf9a84da306f203cf906aea0a4aeedb4fd992b6cfc3e8",
      "paragraph_sequence_sha256": "5a3321e70fff8a8c24246fb1bf39db2b8ae57efd9c1b71ee9564050cadb56cfe"
    },
    "narrative_including_headings": {
      "nonempty_paragraphs": 1820,
      "characters_excluding_whitespace": 109694,
      "text_sha256_excluding_whitespace": "aa33449595433753ad2ae1044dbc276fdfc53fadf99741a007ab4b6dca90fc43",
      "paragraph_sequence_sha256": "4427d7c7a70ab9e03e6345a1bd680c811d8296204e521033bb59b8b49d6af9c3"
    },
    "narrative_excluding_headings": {
      "nonempty_paragraphs": 1800,
      "characters_excluding_whitespace": 109607,
      "text_sha256_excluding_whitespace": "f904b575762255a0b9f3b8ce94c8e2f51b9f8ac40e5602bc7d02784b790a2fc7",
      "paragraph_sequence_sha256": "89e6e2417281f0bcdea3d220f15fd264418917b9cc14444dbf789c41e1daeddf"
    }
  },
  "toc": [
    {
      "title": "一、新年",
      "stored_page_number": 1
    },
    {
      "title": "二、异梦",
      "stored_page_number": 14
    },
    {
      "title": "三、指环",
      "stored_page_number": 21
    },
    {
      "title": "四、往事",
      "stored_page_number": 29
    },
    {
      "title": "五、访客",
      "stored_page_number": 41
    },
    {
      "title": "六、梦婆",
      "stored_page_number": 50
    },
    {
      "title": "七、谜团",
      "stored_page_number": 58
    },
    {
      "title": "八、真相",
      "stored_page_number": 68
    },
    {
      "title": "九、追忆",
      "stored_page_number": 78
    },
    {
      "title": "十、故乡",
      "stored_page_number": 85
    },
    {
      "title": "十一、重逢",
      "stored_page_number": 92
    },
    {
      "title": "十二、浮城",
      "stored_page_number": 100
    },
    {
      "title": "十三、祭司",
      "stored_page_number": 107
    },
    {
      "title": "十四、米娅",
      "stored_page_number": 114
    },
    {
      "title": "十五、陷阱",
      "stored_page_number": 120
    },
    {
      "title": "十六、高塔",
      "stored_page_number": 129
    },
    {
      "title": "十七、博士",
      "stored_page_number": 136
    },
    {
      "title": "十八、基地",
      "stored_page_number": 143
    },
    {
      "title": "十九、末日",
      "stored_page_number": 150
    },
    {
      "title": "尾声",
      "stored_page_number": 156
    },
    {
      "title": "附录：遗落的传说",
      "stored_page_number": 171
    },
    {
      "title": "后记",
      "stored_page_number": 177
    }
  ],
  "units": [
    {
      "unit_id": "front-matter",
      "title": null,
      "source_number": null,
      "role": "front_matter",
      "section_kind": "front_matter",
      "start_paragraph": 1,
      "end_paragraph": 29,
      "statistics": {
        "nonempty_paragraphs": 26,
        "characters_excluding_whitespace": 174,
        "text_sha256_excluding_whitespace": "09cb773e04a9467dacf3b5e0cc1afffac1a916ce2897847b0be637eef6feb08b",
        "paragraph_sequence_sha256": "29dcc7ccf743fe3408a63a3798538f29e2aeba0e916c571b2e721709d9fe3d7c"
      },
      "characters_excluding_heading_and_whitespace": 174,
      "opening_anchor": "遗落梦境与记忆尽头",
      "closing_anchor": "后记\t177"
    },
    {
      "unit_id": "body-unit-01",
      "title": "一、新年",
      "source_number": "一",
      "role": "chapter",
      "section_kind": "numbered_chapter",
      "start_paragraph": 30,
      "end_paragraph": 214,
      "statistics": {
        "nonempty_paragraphs": 162,
        "characters_excluding_whitespace": 8612,
        "text_sha256_excluding_whitespace": "5fbfe21b27c5f65ad76a206446dfbb9e758f85db4226d08c96439636df325905",
        "paragraph_sequence_sha256": "3e285d5ef8eb889041b28ca12b94f0147213d244f7d81922337b33f2e76f53da"
      },
      "characters_excluding_heading_and_whitespace": 8608,
      "opening_anchor": "一、新年",
      "closing_anchor": "这个时候，外面传来几声闷响。隔着小窗，他们看见了五颜六色的光——那是庆祝新年的人们开始燃放烟火。"
    },
    {
      "unit_id": "body-unit-02",
      "title": "二、异梦",
      "source_number": "二",
      "role": "chapter",
      "section_kind": "numbered_chapter",
      "start_paragraph": 215,
      "end_paragraph": 295,
      "statistics": {
        "nonempty_paragraphs": 66,
        "characters_excluding_whitespace": 4670,
        "text_sha256_excluding_whitespace": "0c160e9f8fb55e0af17abd48fb9f7dd4a93f479b4203c7b7d7928fd13a093bfc",
        "paragraph_sequence_sha256": "805687723fec27993ebca6f260714613033ba9a0d179495419bf23ff19f4e867"
      },
      "characters_excluding_heading_and_whitespace": 4666,
      "opening_anchor": "二、异梦",
      "closing_anchor": "陆一鸣这么一想，心里竟也变得坦然。"
    },
    {
      "unit_id": "body-unit-03",
      "title": "三、指环",
      "source_number": "三",
      "role": "chapter",
      "section_kind": "numbered_chapter",
      "start_paragraph": 296,
      "end_paragraph": 411,
      "statistics": {
        "nonempty_paragraphs": 101,
        "characters_excluding_whitespace": 5157,
        "text_sha256_excluding_whitespace": "04da6685ee4b5ac07b74d0cb51f275d00711d660755b9235d6483d56ce5e8356",
        "paragraph_sequence_sha256": "5bb9ef5e5e2c70130c6055e28309eab2862fd7f7594cadc7aea03d9e23b393ed"
      },
      "characters_excluding_heading_and_whitespace": 5153,
      "opening_anchor": "三、指环",
      "closing_anchor": "突然，一个机仆不知从哪儿钻了出来，嘎吱嘎吱地跑到他跟前，问：“先生，需要帮忙吗？”"
    },
    {
      "unit_id": "body-unit-04",
      "title": "四、往事",
      "source_number": "四",
      "role": "chapter",
      "section_kind": "numbered_chapter",
      "start_paragraph": 412,
      "end_paragraph": 558,
      "statistics": {
        "nonempty_paragraphs": 113,
        "characters_excluding_whitespace": 7899,
        "text_sha256_excluding_whitespace": "069bbd0c78f598fad368a4c7d39885f383b46813c3bfccaa049aae226decc40d",
        "paragraph_sequence_sha256": "c3c9892bcf991f25365f34d3aebe71009a1201180c10b0b7ca277623a90c54de"
      },
      "characters_excluding_heading_and_whitespace": 7895,
      "opening_anchor": "四、往事",
      "closing_anchor": "了地。他不断对陆一鸣说自己没看走眼。在陆一鸣启程前，陈向南还特意调拨了十好几箱上好的法兰西干邑，配到先遣队的必需物资里。"
    },
    {
      "unit_id": "body-unit-05",
      "title": "五、访客",
      "source_number": "五",
      "role": "chapter",
      "section_kind": "numbered_chapter",
      "start_paragraph": 559,
      "end_paragraph": 658,
      "statistics": {
        "nonempty_paragraphs": 84,
        "characters_excluding_whitespace": 6139,
        "text_sha256_excluding_whitespace": "350d373cfdc61abb7982db7411d57433798de963580f8180c97bbd1a132c4cab",
        "paragraph_sequence_sha256": "c1c68e7c0359457fd393520aa4eb1267c3d54bac5d00514541a4f79073d2d304"
      },
      "characters_excluding_heading_and_whitespace": 6135,
      "opening_anchor": "五、访客",
      "closing_anchor": "“别——”陆一鸣急忙摆手，“算了！还是别了。”"
    },
    {
      "unit_id": "body-unit-06",
      "title": "六、梦婆",
      "source_number": "六",
      "role": "chapter",
      "section_kind": "numbered_chapter",
      "start_paragraph": 659,
      "end_paragraph": 744,
      "statistics": {
        "nonempty_paragraphs": 74,
        "characters_excluding_whitespace": 5489,
        "text_sha256_excluding_whitespace": "6e0ee06db5b1b7d363016b546c9cbcd48968ba6117c91cad8a401d6cfb585cf8",
        "paragraph_sequence_sha256": "129b9a6c8dadbe5aabcb2d82527ab01bcb4178a2a0cb30dea5232aecfdb58b42"
      },
      "characters_excluding_heading_and_whitespace": 5485,
      "opening_anchor": "六、梦婆",
      "closing_anchor": "“伊丝，你在乱说什么啊！”陈柳的脸又红了，她嗔怒地跺了跺脚，责怪起这个胡乱说话的老太婆来。"
    },
    {
      "unit_id": "body-unit-07",
      "title": "七、谜团",
      "source_number": "七",
      "role": "chapter",
      "section_kind": "numbered_chapter",
      "start_paragraph": 745,
      "end_paragraph": 854,
      "statistics": {
        "nonempty_paragraphs": 97,
        "characters_excluding_whitespace": 7030,
        "text_sha256_excluding_whitespace": "0b8e50b8351ac5303293ae9a8ff0a52161e394e61bab844267c5c7d11bbc014f",
        "paragraph_sequence_sha256": "53fcc148c7ee76c6c0062acb70251b4d3f9e2278d92fb40b20882a0c1bcc1e93"
      },
      "characters_excluding_heading_and_whitespace": 7026,
      "opening_anchor": "七、谜团",
      "closing_anchor": "“帮！当然帮！”齐孝军哪还顾得上细究陆一鸣那团乱麻般的行事逻辑，俯身凑过去，拍了拍对方的肩膀，算是应了下来。"
    },
    {
      "unit_id": "body-unit-08",